{
  "actor": {
    "agent_id": "canon-reviewer-024",
    "role": "reviewer",
    "session_id": "canon-reviewer-024-1"
  },
  "at": "2026-10-19T08:50:29.833520Z",
  "kind": "review",
  "pin": "da018833",
  "pins": {
    "checks": [
      {
        "checks": [],
        "role": "implementer",
        "verdict": "faithful"
      }
    ],
    "scenario_digest": "6fd7ecccaab6c36860abcfd17417aba6d1637ba6c671cb03cc55655ab4ac509e",
    "scenario_digest_scope": "scenario"
  },
  "project_id": "canon",
  "provenance_ref": {
    "upstream_ref": "feat/0.24"
  },
  "reviewer": "canon-reviewer-024",
  "scenario_id": "context.capability.16",
  "schema": 1
}