{
  "actor": {
    "agent_id": "canon-reviewer-g5",
    "role": "reviewer"
  },
  "at": "2026-10-09T05:56:01.043985Z",
  "kind": "review",
  "pin": "b556ab7529a332aa0b28d0a0f98bdd62fcbb9a63",
  "pins": {
    "checks": [
      {
        "checks": [],
        "role": "implementer",
        "verdict": "faithful"
      }
    ],
    "scenario_digest": "ee03ca33016120d309c9a6f72ead8b6adb0656067607b30f60dc5e08f9d51fe7",
    "scenario_digest_scope": "scenario"
  },
  "project_id": "canon",
  "provenance_ref": {
    "upstream_ref": "docs/superpowers/plans/2026-10-09-canon-0.13.0-reviewed-corpus.md#RV1"
  },
  "reviewer": "canon-reviewer-g5",
  "scenario_id": "query.read.06",
  "schema": 1
}