{
  "actor": {
    "agent_id": "canon-reviewer-017-p4",
    "role": "reviewer",
    "session_id": "review-017-p4"
  },
  "at": "2026-10-12T12:08:54.805350Z",
  "kind": "review",
  "pin": "e4396c9b925d30db841a2018528ac6579b9ec9c9",
  "pins": {
    "evidence": [
      {
        "digest": "6e770e9760d2",
        "key": "authoring.migrate.06"
      }
    ],
    "scenario_digest": "818bf31e3975822d5a0e1a42d3da14e60eeb836579475346fc68ed02b0552a19",
    "scenario_digest_scope": "scenario"
  },
  "project_id": "canon",
  "provenance_ref": {
    "upstream_ref": "docs/superpowers/plans/2026-10-12-canon-0.17.0-own-home.md#D6"
  },
  "reviewer": "canon-reviewer-017-p4",
  "scenario_id": "authoring.migrate.06",
  "schema": 1
}