{
  "actor": {
    "agent_id": "canon-reviewer-026",
    "role": "reviewer",
    "session_id": "canon-reviewer-026-1"
  },
  "at": "2026-10-21T17:16:14.331865703Z",
  "kind": "review",
  "pin": "8eff1e8",
  "pins": {
    "checks": [
      {
        "checks": [],
        "role": "implementer",
        "verdict": "faithful"
      }
    ],
    "scenario_digest": "396b4260ffdc67cc2e837935152572cd355d46a7fb854f71c06118165ba09714",
    "scenario_digest_scope": "scenario"
  },
  "project_id": "canon",
  "provenance_ref": {
    "upstream_ref": "origin/main"
  },
  "reviewer": "canon-reviewer-026",
  "scenario_id": "authoring.brief-check.14",
  "schema": 1
}