{
  "actor": {
    "agent_id": "canon-reviewer-g4",
    "role": "reviewer"
  },
  "at": "2026-10-09T05:55:59.769116Z",
  "kind": "review",
  "pin": "b556ab7529a332aa0b28d0a0f98bdd62fcbb9a63",
  "project_id": "canon",
  "provenance_ref": {
    "upstream_ref": "docs/superpowers/plans/2026-10-09-canon-0.13.0-reviewed-corpus.md#RV1"
  },
  "reviewer": "canon-reviewer-g4",
  "scenario_id": "authoring.scaffold.04",
  "schema": 1
}