{
  "actor": {
    "agent_id": "canon-reviewer-018-n5",
    "role": "reviewer",
    "session_id": "review-018-n5"
  },
  "at": "2026-10-12T15:22:32.136705Z",
  "kind": "review",
  "pin": "8f682391e68cbefebd6792c92c7386b2baf1b671",
  "pins": {
    "evidence": [
      {
        "digest": "a31ada1afe89",
        "key": "platformer.levels.01"
      }
    ],
    "scenario_digest": "3ba0959224e735d0926ae299daaa8b130212daceca21450636698253ed80b169",
    "scenario_digest_scope": "scenario"
  },
  "project_id": "platformer",
  "provenance_ref": {
    "upstream_ref": "docs/superpowers/plans/2026-10-12-canon-0.18.0-fewer-calls.md#D7"
  },
  "reviewer": "canon-reviewer-018-n5",
  "scenario_id": "platformer.levels.01",
  "schema": 1
}