{
  "actor": {
    "agent_id": "canon-reviewer-k6",
    "role": "reviewer"
  },
  "at": "2026-10-10T16:47:47.699811Z",
  "kind": "review",
  "pin": "16412678b7b1dbb710f348eea1f753215f2e0ae3",
  "project_id": "canon",
  "provenance_ref": {
    "upstream_ref": "docs/superpowers/plans/2026-10-11-canon-0.14.0-working-loop.md#K6"
  },
  "reviewer": "canon-reviewer-k6",
  "scenario_id": "skills.install.11",
  "schema": 1
}