{
  "actor": {
    "agent_id": "canon-reviewer-g2",
    "role": "reviewer"
  },
  "at": "2026-10-09T05:55:58.731931Z",
  "kind": "review",
  "pin": "b556ab7529a332aa0b28d0a0f98bdd62fcbb9a63",
  "pins": {
    "checks": [
      {
        "checks": [],
        "role": "implementer",
        "verdict": "faithful"
      }
    ],
    "scenario_digest": "9aac83409b14842e26bd795d693617ea71b13672ddb8e2a54088d00329500181",
    "scenario_digest_scope": "scenario"
  },
  "project_id": "canon",
  "provenance_ref": {
    "upstream_ref": "docs/superpowers/plans/2026-10-09-canon-0.13.0-reviewed-corpus.md#RV1"
  },
  "reviewer": "canon-reviewer-g2",
  "scenario_id": "ingest.sessions.13",
  "schema": 1
}