{
  "actor": {
    "agent_id": "canon-reviewer-015-l2",
    "role": "reviewer",
    "session_id": "review-015-l2"
  },
  "at": "2026-10-10T19:55:26.049639Z",
  "kind": "review",
  "pin": "539d7384fd54858b1cf5b837adf8c84faca3234c",
  "pins": {
    "evidence": [
      {
        "digest": "a66c4417b5ee",
        "key": "evidence.add.41"
      }
    ],
    "scenario_digest": "180f8c6bc8832fd0ed291c82d40435a0a3ccebbd99c67e3d7459d633e158c6a2"
  },
  "project_id": "canon",
  "provenance_ref": {
    "upstream_ref": "docs/superpowers/plans/2026-10-11-canon-0.15.0-evidence-holds.md#L2"
  },
  "reviewer": "canon-reviewer-015-l2",
  "scenario_id": "evidence.add.41",
  "schema": 1
}