{
  "actor": {
    "agent_id": "canon-reviewer-023",
    "role": "reviewer",
    "session_id": "canon-reviewer-023-1"
  },
  "at": "2026-10-17T20:15:03.978822Z",
  "kind": "review",
  "pin": "9533ed1eae0aff89b28dacca20da7cc180e9fa7a",
  "pins": {
    "evidence": [
      {
        "digest": "70db65dcaec5",
        "key": "divergence.lifecycle.04"
      }
    ],
    "scenario_digest": "2f5fdf7d677d81db2893d12d317f1d6f6ee1d0ff626208d7ca4261b48dc532fc",
    "scenario_digest_scope": "scenario"
  },
  "project_id": "canon",
  "provenance_ref": {
    "upstream_ref": "feat/0.23"
  },
  "reviewer": "canon-reviewer-023",
  "scenario_id": "divergence.lifecycle.04",
  "schema": 1
}