{
  "actor": {
    "agent_id": "canon-reviewer-018-n5",
    "role": "reviewer",
    "session_id": "review-018-n5"
  },
  "at": "2026-10-12T15:22:32.136705Z",
  "kind": "review",
  "pin": "8f682391e68cbefebd6792c92c7386b2baf1b671",
  "pins": {
    "checks": [
      {
        "checks": [
          "junit:platformer.movement.03: No double jump; coyote and buffered jumps fire"
        ],
        "role": "implementer",
        "verdict": "faithful"
      }
    ],
    "scenario_digest": "d542368121009f4990b010b35a3f4e64408e12eff538c3b5a410cd469f123345",
    "scenario_digest_scope": "scenario"
  },
  "project_id": "platformer",
  "provenance_ref": {
    "upstream_ref": "docs/superpowers/plans/2026-10-12-canon-0.18.0-fewer-calls.md#D7"
  },
  "reviewer": "canon-reviewer-018-n5",
  "scenario_id": "platformer.movement.03",
  "schema": 1
}