{
  "actor": {
    "agent_id": "canon-reviewer-r2",
    "role": "reviewer"
  },
  "at": "2026-10-09T05:56:01.910559Z",
  "kind": "review",
  "pin": "979d7b67aa071032affb55561bf65ee292f2a737",
  "pins": {
    "checks": [
      {
        "checks": [],
        "role": "implementer",
        "verdict": "faithful"
      }
    ],
    "scenario_digest": "24bf2e122b4283cc8e9d34e7aed44edb5be9762524e1defc0b4e323afe7ed40e",
    "scenario_digest_scope": "scenario"
  },
  "project_id": "canon",
  "provenance_ref": {
    "upstream_ref": "docs/superpowers/plans/2026-10-09-canon-0.13.0-reviewed-corpus.md#RV3"
  },
  "reviewer": "canon-reviewer-r2",
  "scenario_id": "report.generation.07",
  "schema": 1
}