{
  "actor": {
    "agent_id": "canon-reviewer-g3",
    "role": "reviewer"
  },
  "at": "2026-10-09T05:55:59.295373Z",
  "kind": "review",
  "pin": "b556ab7529a332aa0b28d0a0f98bdd62fcbb9a63",
  "pins": {
    "checks": [
      {
        "checks": [],
        "role": "implementer",
        "verdict": "faithful"
      }
    ],
    "scenario_digest": "4d8efb330614e5234a970e15c357fcd313008ef36e82bec812e119e8351dd69c",
    "scenario_digest_scope": "scenario"
  },
  "project_id": "canon",
  "provenance_ref": {
    "upstream_ref": "docs/superpowers/plans/2026-10-09-canon-0.13.0-reviewed-corpus.md#RV1"
  },
  "reviewer": "canon-reviewer-g3",
  "scenario_id": "subject.lifecycle.19",
  "schema": 1
}